{
  "schema_version": "2.0",
  "project": {
    "code": "Double-RR",
    "name": "Double RR Ranch - East Cabins",
    "number": "DRLR-2026-001"
  },
  "submittal_number": "WW-2026-001",
  "revision": "0",
  "submittal_title": "Plumbing Equipment and Materials",
  "items": [
    {
      "item_number": 1,
      "description": "Pressure Reducing Valve",
      "manufacturer": "Watts",
      "model_number": "LF25AUB-Z3",
      "spec_section": "22 05 23",
      "documents": [
        {
          "type": "cut_sheet",
          "path": "vendor-docs/Watts/Cut-Sheets/Watts_LF25AUB_Cut-Sheet.pdf"
        }
      ]
    }
  ]
}
